{"$schema":"https://json-schema.org/draft/2020-12/schema","type":"object","required":["schema_version","baseline_commit","source","cases"],"properties":{"schema_version":{"const":1},"baseline_commit":{"const":"0aac58e466d583d0f0436df7b8afa3dc96191263"},"source":{"const":"jasmin/routing/Routes.py"},"cases":{"type":"array","minItems":16,"maxItems":16,"items":{"type":"object","required":["id","source","input","expected","error_type"],"properties":{"id":{"type":"string"},"source":{"const":"jasmin/routing/Routes.py"},"input":{"type":"object"},"expected":{},"error_type":{"type":["string","null"]}},"additionalProperties":false}}},"additionalProperties":false}
